{
  "$schema": "../schemas/file-inventory.schema.json",
  "description": "File inventory for mcp-server source snapshot.",
  "id": "mcp-server",
  "source_repo": "atomicstrata/atomicmemory-integrations",
  "source_ref": "main",
  "source_commit": "287e9ba80f215a08588fd5da543bd15741c045dd",
  "source_subpath": "packages/mcp-server",
  "target_path": "packages/mcp-server",
  "target_commit": "25a2c6af4fde02be1f776e08ef44e7778b76216e",
  "allowlist": "docs/migration/allowlists/mcp-server.json",
  "copied_on": "2026-05-18T01:56:30-07:00",
  "copy_tool": "scripts/ci/migration-inventories.mjs --write",
  "files": [
    {
      "source_path": "packages/mcp-server/CHANGELOG.md",
      "target_path": "packages/mcp-server/CHANGELOG.md",
      "sha256": "ef5dc7823f81d3b96f986429e1b2e3b88ef31c5566c6b1ad449975bf8dfec842",
      "size_bytes": 273,
      "matched_include": "CHANGELOG.md"
    },
    {
      "source_path": "packages/mcp-server/README.md",
      "target_path": "packages/mcp-server/README.md",
      "sha256": "9bbde483bfe537ec1b864e87154259511005379dd33bac4e2071188d8cc2472d",
      "size_bytes": 3631,
      "matched_include": "README.md"
    },
    {
      "source_path": "packages/mcp-server/package.json",
      "target_path": "packages/mcp-server/package.json",
      "sha256": "e220498bd39b5fe1342da67044a960bba80a327124e7d59b7fe0f63f3f03c7e5",
      "size_bytes": 1863,
      "matched_include": "package.json"
    },
    {
      "source_path": "packages/mcp-server/src/bin-stdio.test.ts",
      "target_path": "packages/mcp-server/src/bin-stdio.test.ts",
      "sha256": "7ddb0b41bf3b5627b79037de5736d61839a3adca73eab4217094683b09934358",
      "size_bytes": 4499,
      "matched_include": "src/**"
    },
    {
      "source_path": "packages/mcp-server/src/bin.ts",
      "target_path": "packages/mcp-server/src/bin.ts",
      "sha256": "7d848a5a4c2486c0fb5c44fa70f762fc7b7fe69321f94d3a6cdb296fa26bc67e",
      "size_bytes": 2558,
      "matched_include": "src/**"
    },
    {
      "source_path": "packages/mcp-server/src/config.test.ts",
      "target_path": "packages/mcp-server/src/config.test.ts",
      "sha256": "19880d934822c1509a75863fb4768cfa184eb0034f70e88438c039247e4f54dd",
      "size_bytes": 2207,
      "matched_include": "src/**"
    },
    {
      "source_path": "packages/mcp-server/src/config.ts",
      "target_path": "packages/mcp-server/src/config.ts",
      "sha256": "e5e104b4b94e9cb58a8780fb177087a5f3aea9fb7f114aec1c239ca55d4c7f88",
      "size_bytes": 3521,
      "matched_include": "src/**"
    },
    {
      "source_path": "packages/mcp-server/src/embedded-client.ts",
      "target_path": "packages/mcp-server/src/embedded-client.ts",
      "sha256": "f45f12056734194d482ae9ed13c633aacfdcab4f293c2baf7bb069b642f3ccef",
      "size_bytes": 1181,
      "matched_include": "src/**"
    },
    {
      "source_path": "packages/mcp-server/src/index.ts",
      "target_path": "packages/mcp-server/src/index.ts",
      "sha256": "b51c954be209f38bfbc32053c0a1e5cb2be5a9e330e2ad980818147e8acec47a",
      "size_bytes": 585,
      "matched_include": "src/**"
    },
    {
      "source_path": "packages/mcp-server/src/server.ts",
      "target_path": "packages/mcp-server/src/server.ts",
      "sha256": "2bba5695d8da0995dfd1277581aa7b81d8112dded787dc1468d272f4580d60f7",
      "size_bytes": 6722,
      "matched_include": "src/**"
    },
    {
      "source_path": "packages/mcp-server/src/spawn.ts",
      "target_path": "packages/mcp-server/src/spawn.ts",
      "sha256": "ff55fc287b395546ae26b8129d5fac3ced5b9dc06a92f0ba34670456b0e55713",
      "size_bytes": 909,
      "matched_include": "src/**"
    },
    {
      "source_path": "packages/mcp-server/src/tools.scoping.test.ts",
      "target_path": "packages/mcp-server/src/tools.scoping.test.ts",
      "sha256": "1b7a16d2e3ebcd9589ba62884f9cbd404e3b2d4ea48ffdf21dfa3826d420d007",
      "size_bytes": 7935,
      "matched_include": "src/**"
    },
    {
      "source_path": "packages/mcp-server/src/tools.test.ts",
      "target_path": "packages/mcp-server/src/tools.test.ts",
      "sha256": "3783163757a6f2456ff4b7f3d37c7bdffad148276ff0d1864e9795c44a326a71",
      "size_bytes": 7135,
      "matched_include": "src/**"
    },
    {
      "source_path": "packages/mcp-server/src/tools.ts",
      "target_path": "packages/mcp-server/src/tools.ts",
      "sha256": "fb244022015fc581c3b28d40f668cf4af9c9e5ed1c7c643ca36da9c088845c5a",
      "size_bytes": 10628,
      "matched_include": "src/**"
    },
    {
      "source_path": "packages/mcp-server/tsconfig.json",
      "target_path": "packages/mcp-server/tsconfig.json",
      "sha256": "5387dc745d87e9db26206985bc8353c061838a0dc45bddb5d4cca88a9716a03f",
      "size_bytes": 181,
      "matched_include": "tsconfig.json"
    }
  ],
  "summary": {
    "file_count": 15,
    "total_size_bytes": 53828
  },
  "verification": {
    "allowlist_checked": true,
    "inventory_source": "git tree at target_commit",
    "reviewer_signoff": "pending CODEOWNERS review",
    "note": "15 files matched against docs/migration/allowlists/mcp-server.json."
  }
}
