{
  "$schema": "../schemas/file-inventory.schema.json",
  "description": "File inventory for adapter-openai-agents source snapshot.",
  "id": "adapter-openai-agents",
  "source_repo": "atomicstrata/atomicmemory-integrations",
  "source_ref": "main",
  "source_commit": "287e9ba80f215a08588fd5da543bd15741c045dd",
  "source_subpath": "adapters/openai-agents-sdk",
  "target_path": "adapters/openai-agents",
  "target_commit": "25a2c6af4fde02be1f776e08ef44e7778b76216e",
  "allowlist": "docs/migration/allowlists/adapter-openai-agents.json",
  "copied_on": "2026-05-18T01:56:30-07:00",
  "copy_tool": "scripts/ci/migration-inventories.mjs --write",
  "files": [
    {
      "source_path": "adapters/openai-agents-sdk/README.md",
      "target_path": "adapters/openai-agents/README.md",
      "sha256": "3964129a52f7ae6696fc5fa9d2df6bc472843df7ed748483e83e7406383cb828",
      "size_bytes": 4210,
      "matched_include": "README.md"
    },
    {
      "source_path": "adapters/openai-agents-sdk/package.json",
      "target_path": "adapters/openai-agents/package.json",
      "sha256": "42450cc8745d5e22ea8b6799f0a97ba45c0a123bebba043b0e11aac0f902ecbb",
      "size_bytes": 1655,
      "matched_include": "package.json"
    },
    {
      "source_path": "adapters/openai-agents-sdk/scripts/smoke-backend.mjs",
      "target_path": "adapters/openai-agents/scripts/smoke-backend.mjs",
      "sha256": "d92fc080d05f16b5e1d2356bdd5b498b34e3d9b8a91398258a78baf2b7035dee",
      "size_bytes": 2617,
      "matched_include": "scripts/**"
    },
    {
      "source_path": "adapters/openai-agents-sdk/src/augment.test.ts",
      "target_path": "adapters/openai-agents/src/augment.test.ts",
      "sha256": "7c3b70dd62bfb9b0513cc60914c14349104217a28e9331f530ee3f0706b2fa65",
      "size_bytes": 1992,
      "matched_include": "src/**"
    },
    {
      "source_path": "adapters/openai-agents-sdk/src/augment.ts",
      "target_path": "adapters/openai-agents/src/augment.ts",
      "sha256": "4abb26c089cd3f67359d9a8a02670662c6c1e4276c27b07717a4db23f08354de",
      "size_bytes": 2422,
      "matched_include": "src/**"
    },
    {
      "source_path": "adapters/openai-agents-sdk/src/index.ts",
      "target_path": "adapters/openai-agents/src/index.ts",
      "sha256": "4b3ad446d37f6d3bfa61f86b49339bd3a461d7943acaf590ec209251087f5308",
      "size_bytes": 1197,
      "matched_include": "src/**"
    },
    {
      "source_path": "adapters/openai-agents-sdk/src/ingest.test.ts",
      "target_path": "adapters/openai-agents/src/ingest.test.ts",
      "sha256": "48c86672f23b05dbfe08e1c780d17e4824e6578e93486396bbb72064eac4b49e",
      "size_bytes": 2132,
      "matched_include": "src/**"
    },
    {
      "source_path": "adapters/openai-agents-sdk/src/ingest.ts",
      "target_path": "adapters/openai-agents/src/ingest.ts",
      "sha256": "3ff4d00573c9bbedd43c7517941ef9cec591bd35e18d6775ead67db2af55580c",
      "size_bytes": 1868,
      "matched_include": "src/**"
    },
    {
      "source_path": "adapters/openai-agents-sdk/src/messages.ts",
      "target_path": "adapters/openai-agents/src/messages.ts",
      "sha256": "dcebc5c8faf51a1eb254fbf9ee42178d3daa624f5ecf75177fd8cf4b7cec1e98",
      "size_bytes": 2425,
      "matched_include": "src/**"
    },
    {
      "source_path": "adapters/openai-agents-sdk/src/run-with-memory.test.ts",
      "target_path": "adapters/openai-agents/src/run-with-memory.test.ts",
      "sha256": "335968ea6e1108f504924200e8459cfb2bcfe85df927e189c474c2ddcf5e7d37",
      "size_bytes": 1167,
      "matched_include": "src/**"
    },
    {
      "source_path": "adapters/openai-agents-sdk/src/run-with-memory.ts",
      "target_path": "adapters/openai-agents/src/run-with-memory.ts",
      "sha256": "d14c84e00ce3171ead661fe27ed7b2fee3318a450a68e0c67dd556488b6ac081",
      "size_bytes": 2463,
      "matched_include": "src/**"
    },
    {
      "source_path": "adapters/openai-agents-sdk/src/test-fixtures.ts",
      "target_path": "adapters/openai-agents/src/test-fixtures.ts",
      "sha256": "3451f8f9eaa23ce7c1c041c5c090c09ba5aac7eb03f9c81188a43f2398eb7c2c",
      "size_bytes": 1277,
      "matched_include": "src/**"
    },
    {
      "source_path": "adapters/openai-agents-sdk/src/tools.test.ts",
      "target_path": "adapters/openai-agents/src/tools.test.ts",
      "sha256": "0e2622721b7a7680e96053b7b6deae1a723cf2842e7fffe24f9a07401f743216",
      "size_bytes": 461,
      "matched_include": "src/**"
    },
    {
      "source_path": "adapters/openai-agents-sdk/src/tools.ts",
      "target_path": "adapters/openai-agents/src/tools.ts",
      "sha256": "945b956d72cf58df743781ae42f49655e4639b338e3b8f28ef130c145c134d2c",
      "size_bytes": 2028,
      "matched_include": "src/**"
    },
    {
      "source_path": "adapters/openai-agents-sdk/tsconfig.json",
      "target_path": "adapters/openai-agents/tsconfig.json",
      "sha256": "b1df01c7b3ffbfde2f65f433286f600e3ff181d47db39bce8337daea3c30a2c7",
      "size_bytes": 145,
      "matched_include": "tsconfig.json"
    }
  ],
  "summary": {
    "file_count": 15,
    "total_size_bytes": 28059
  },
  "verification": {
    "allowlist_checked": true,
    "inventory_source": "git tree at target_commit",
    "reviewer_signoff": "pending CODEOWNERS review",
    "note": "15 files matched against docs/migration/allowlists/adapter-openai-agents.json."
  }
}
