{
  "$schema": "../schemas/file-inventory.schema.json",
  "description": "File inventory for plugin-claude-code source snapshot.",
  "id": "plugin-claude-code",
  "source_repo": "atomicstrata/atomicmemory-integrations",
  "source_ref": "main",
  "source_commit": "287e9ba80f215a08588fd5da543bd15741c045dd",
  "source_subpath": "plugins/claude-code",
  "target_path": "plugins/claude-code",
  "target_commit": "25a2c6af4fde02be1f776e08ef44e7778b76216e",
  "allowlist": "docs/migration/allowlists/plugin-claude-code.json",
  "copied_on": "2026-05-18T01:56:30-07:00",
  "copy_tool": "scripts/ci/migration-inventories.mjs --write",
  "files": [
    {
      "source_path": "plugins/claude-code/.claude-plugin/plugin.json",
      "target_path": "plugins/claude-code/.claude-plugin/plugin.json",
      "sha256": "d74dcf071e529dcf1dd624e1d259835139ec9f920e5feed78e4673faec187e63",
      "size_bytes": 1117,
      "matched_include": ".claude-plugin/**"
    },
    {
      "source_path": "plugins/claude-code/README.md",
      "target_path": "plugins/claude-code/README.md",
      "sha256": "c16960634b34c3ab2db60e7d3954b0b386928896f9fe42863e29458fef82caaa",
      "size_bytes": 13268,
      "matched_include": "README.md"
    },
    {
      "source_path": "plugins/claude-code/hooks/hooks.json",
      "target_path": "plugins/claude-code/hooks/hooks.json",
      "sha256": "922a568b22d1181c9a495efe286eb426aee79ee14759871f2eb7f3be91b59f12",
      "size_bytes": 2409,
      "matched_include": "hooks/**"
    },
    {
      "source_path": "plugins/claude-code/package.json",
      "target_path": "plugins/claude-code/package.json",
      "sha256": "808936cdca66031bbcc6f03d30e5c6f72629a7c69ae34afd683c647b41ad8ff8",
      "size_bytes": 816,
      "matched_include": "package.json"
    },
    {
      "source_path": "plugins/claude-code/scripts/__tests__/auth-header.sh",
      "target_path": "plugins/claude-code/scripts/__tests__/auth-header.sh",
      "sha256": "d4e825bbb076ea8d1516f028da58b32b576a2fe5372ffd3d2b5398b13915121c",
      "size_bytes": 4781,
      "matched_include": "scripts/**"
    },
    {
      "source_path": "plugins/claude-code/scripts/__tests__/load-env-defaults.sh",
      "target_path": "plugins/claude-code/scripts/__tests__/load-env-defaults.sh",
      "sha256": "31aceb0144629fe358dd22cd5190773b185366f6f0cfb38c213bc0c3548126ff",
      "size_bytes": 4095,
      "matched_include": "scripts/**"
    },
    {
      "source_path": "plugins/claude-code/scripts/__tests__/metadata-roundtrip.sh",
      "target_path": "plugins/claude-code/scripts/__tests__/metadata-roundtrip.sh",
      "sha256": "dd758adfbf2e766c1e35f79b23f13d2861940ede5bb0569cb0c2597638448794",
      "size_bytes": 3516,
      "matched_include": "scripts/**"
    },
    {
      "source_path": "plugins/claude-code/scripts/__tests__/quick-ingest-body.sh",
      "target_path": "plugins/claude-code/scripts/__tests__/quick-ingest-body.sh",
      "sha256": "3ed2cf1bc655cc0fe9f8a7d19ae74e0a712bba46d673c1487cf6279c6fd5e1bf",
      "size_bytes": 4960,
      "matched_include": "scripts/**"
    },
    {
      "source_path": "plugins/claude-code/scripts/block_memory_write.sh",
      "target_path": "plugins/claude-code/scripts/block_memory_write.sh",
      "sha256": "f2c475f02858b23239c59c044e3051e6e34b516a0b728a8415f7db309b218f65",
      "size_bytes": 1059,
      "matched_include": "scripts/**"
    },
    {
      "source_path": "plugins/claude-code/scripts/lib/atomicmemory.sh",
      "target_path": "plugins/claude-code/scripts/lib/atomicmemory.sh",
      "sha256": "65493c6ae2194416ec4d6f336a5f4752024658e59dba03d342b49f28d8e722f1",
      "size_bytes": 14022,
      "matched_include": "scripts/**"
    },
    {
      "source_path": "plugins/claude-code/scripts/on_post_compact.sh",
      "target_path": "plugins/claude-code/scripts/on_post_compact.sh",
      "sha256": "43ddb78b396ee3af9594e7ccfb458d7b5401e6dd1edcca9b40ccba7f71892f91",
      "size_bytes": 2129,
      "matched_include": "scripts/**"
    },
    {
      "source_path": "plugins/claude-code/scripts/on_pre_compact.sh",
      "target_path": "plugins/claude-code/scripts/on_pre_compact.sh",
      "sha256": "6a8d970c1af3fecd40c3179c0d59d038704c641e8b5eb640a6781ebe9878871e",
      "size_bytes": 551,
      "matched_include": "scripts/**"
    },
    {
      "source_path": "plugins/claude-code/scripts/on_session_end.sh",
      "target_path": "plugins/claude-code/scripts/on_session_end.sh",
      "sha256": "71a627aef751d07a95f9e88b99ea4928bcf03c1fcb5fd9aec9e7f4490455819e",
      "size_bytes": 858,
      "matched_include": "scripts/**"
    },
    {
      "source_path": "plugins/claude-code/scripts/on_session_start.sh",
      "target_path": "plugins/claude-code/scripts/on_session_start.sh",
      "sha256": "893f2e3993e6e620ecb467903423c30d5832ab8af4a963ecc19c402a28536673",
      "size_bytes": 2004,
      "matched_include": "scripts/**"
    },
    {
      "source_path": "plugins/claude-code/scripts/on_stop.sh",
      "target_path": "plugins/claude-code/scripts/on_stop.sh",
      "sha256": "237c04f41f0c75c227be05408a7c0daf298d3fa27cd39f81d2bd93842719c753",
      "size_bytes": 6056,
      "matched_include": "scripts/**"
    },
    {
      "source_path": "plugins/claude-code/scripts/on_stop_failure.sh",
      "target_path": "plugins/claude-code/scripts/on_stop_failure.sh",
      "sha256": "d3096a8ee44f3ab14be4bd4634761078bf9ed830790d83fc0171609b45b0a21f",
      "size_bytes": 630,
      "matched_include": "scripts/**"
    },
    {
      "source_path": "plugins/claude-code/scripts/on_task_completed.sh",
      "target_path": "plugins/claude-code/scripts/on_task_completed.sh",
      "sha256": "cc63eb9e0d16e9f7501d6a0db8b7dc26719f50c99b355e4fdff3394a197cb276",
      "size_bytes": 3534,
      "matched_include": "scripts/**"
    },
    {
      "source_path": "plugins/claude-code/scripts/on_user_prompt.sh",
      "target_path": "plugins/claude-code/scripts/on_user_prompt.sh",
      "sha256": "5a06b8d7546f5f055a68e223170bf73f58f42f3788793a5001ae2006c0ec60b9",
      "size_bytes": 2221,
      "matched_include": "scripts/**"
    },
    {
      "source_path": "plugins/claude-code/skills/atomicmemory/SKILL.md",
      "target_path": "plugins/claude-code/skills/atomicmemory/SKILL.md",
      "sha256": "4b0b6f4c81ea10e58f74f124b68e44ee462d910664272f84f78beded704e7410",
      "size_bytes": 2272,
      "matched_include": "skills/**"
    }
  ],
  "summary": {
    "file_count": 19,
    "total_size_bytes": 70298
  },
  "verification": {
    "allowlist_checked": true,
    "inventory_source": "git tree at target_commit",
    "reviewer_signoff": "pending CODEOWNERS review",
    "note": "19 files matched against docs/migration/allowlists/plugin-claude-code.json."
  }
}
