{
  "$schema": "../schemas/file-inventory.schema.json",
  "description": "File inventory for adapter-langgraph source snapshot.",
  "id": "adapter-langgraph",
  "source_repo": "atomicstrata/atomicmemory-integrations",
  "source_ref": "feat/integration-maturity-framework-adapters",
  "source_commit": "c6e3b5082af08ff71128478c252894cc9aa6f002",
  "source_subpath": "adapters/langgraph-js",
  "target_path": "adapters/langgraph",
  "target_commit": "25a2c6af4fde02be1f776e08ef44e7778b76216e",
  "allowlist": "docs/migration/allowlists/adapter-langgraph.json",
  "copied_on": "2026-05-18T01:56:30-07:00",
  "copy_tool": "scripts/ci/migration-inventories.mjs --write",
  "files": [
    {
      "source_path": "adapters/langgraph-js/README.md",
      "target_path": "adapters/langgraph/README.md",
      "sha256": "1482d1c99c29939b09d8c1981188d332f587bad9921e9790593f1171e5f4e962",
      "size_bytes": 3541,
      "matched_include": "README.md"
    },
    {
      "source_path": "adapters/langgraph-js/package.json",
      "target_path": "adapters/langgraph/package.json",
      "sha256": "ecbd4723fef441f91fb60fa8063387086573257381001779611c047c028bb7cc",
      "size_bytes": 1693,
      "matched_include": "package.json"
    },
    {
      "source_path": "adapters/langgraph-js/src/index.ts",
      "target_path": "adapters/langgraph/src/index.ts",
      "sha256": "0ff344bc9e9ee5642f191591c4f9ed49c391cc763e4acf166d95af0b972c44f8",
      "size_bytes": 1317,
      "matched_include": "src/**"
    },
    {
      "source_path": "adapters/langgraph-js/src/ingest.test.ts",
      "target_path": "adapters/langgraph/src/ingest.test.ts",
      "sha256": "793420d159540504d6ee0927025a579c7774f6e808ff7a37e94081b5096f982c",
      "size_bytes": 2132,
      "matched_include": "src/**"
    },
    {
      "source_path": "adapters/langgraph-js/src/ingest.ts",
      "target_path": "adapters/langgraph/src/ingest.ts",
      "sha256": "6da3141a93385e495d01fec66125bc802ed53c2893ed52a5ac0cb4b0eb3a21ca",
      "size_bytes": 1225,
      "matched_include": "src/**"
    },
    {
      "source_path": "adapters/langgraph-js/src/nodes.test.ts",
      "target_path": "adapters/langgraph/src/nodes.test.ts",
      "sha256": "bbee1653be0b749add918320fc55f9c4a8177d54ff2a854a76394e95e8d08763",
      "size_bytes": 4692,
      "matched_include": "src/**"
    },
    {
      "source_path": "adapters/langgraph-js/src/nodes.ts",
      "target_path": "adapters/langgraph/src/nodes.ts",
      "sha256": "d74d3b0cb6eb6fbde7480716f059c9801c5e190ce2247e1ca5bbcf6e8375b133",
      "size_bytes": 3466,
      "matched_include": "src/**"
    },
    {
      "source_path": "adapters/langgraph-js/src/search.test.ts",
      "target_path": "adapters/langgraph/src/search.test.ts",
      "sha256": "26867879999ee4476c73974997a6dab4e86419099ed784b85ecb65ffe94983fe",
      "size_bytes": 1897,
      "matched_include": "src/**"
    },
    {
      "source_path": "adapters/langgraph-js/src/search.ts",
      "target_path": "adapters/langgraph/src/search.ts",
      "sha256": "4044b53d155a6a5e5e7df333ce86d8ad17d1c9fa2a78c1aced6a8357fe22ee3f",
      "size_bytes": 1796,
      "matched_include": "src/**"
    },
    {
      "source_path": "adapters/langgraph-js/src/test-fixtures.ts",
      "target_path": "adapters/langgraph/src/test-fixtures.ts",
      "sha256": "6bc67551acc0569b5effd8a6b74f2ee0c3113e60f8518a64e7fd69064be71558",
      "size_bytes": 1257,
      "matched_include": "src/**"
    },
    {
      "source_path": "adapters/langgraph-js/tsconfig.json",
      "target_path": "adapters/langgraph/tsconfig.json",
      "sha256": "5387dc745d87e9db26206985bc8353c061838a0dc45bddb5d4cca88a9716a03f",
      "size_bytes": 181,
      "matched_include": "tsconfig.json"
    }
  ],
  "summary": {
    "file_count": 11,
    "total_size_bytes": 23197
  },
  "verification": {
    "allowlist_checked": true,
    "inventory_source": "git tree at target_commit",
    "reviewer_signoff": "pending CODEOWNERS review",
    "note": "11 files matched against docs/migration/allowlists/adapter-langgraph.json."
  }
}
