{
  "$schema": "../schemas/file-inventory.schema.json",
  "description": "File inventory for adapter-langchain source snapshot.",
  "id": "adapter-langchain",
  "source_repo": "atomicstrata/atomicmemory-integrations",
  "source_ref": "feat/integration-maturity-framework-adapters",
  "source_commit": "c6e3b5082af08ff71128478c252894cc9aa6f002",
  "source_subpath": "adapters/langchain-js",
  "target_path": "adapters/langchain",
  "target_commit": "25a2c6af4fde02be1f776e08ef44e7778b76216e",
  "allowlist": "docs/migration/allowlists/adapter-langchain.json",
  "copied_on": "2026-05-18T01:56:30-07:00",
  "copy_tool": "scripts/ci/migration-inventories.mjs --write",
  "files": [
    {
      "source_path": "adapters/langchain-js/README.md",
      "target_path": "adapters/langchain/README.md",
      "sha256": "316bd00f99e4f20d64b6f92435086dada267c5e6ccdc25b546e2b11fa947ab66",
      "size_bytes": 3264,
      "matched_include": "README.md"
    },
    {
      "source_path": "adapters/langchain-js/package.json",
      "target_path": "adapters/langchain/package.json",
      "sha256": "a0607f565b7d816caa55ad45a3831c406962e5954c8928be1518ea981c47ed78",
      "size_bytes": 1716,
      "matched_include": "package.json"
    },
    {
      "source_path": "adapters/langchain-js/src/index.ts",
      "target_path": "adapters/langchain/src/index.ts",
      "sha256": "35d1f775f3c2633620caac5311a8b193c48c476dc2b8f842ac82fe5cbbfcd28b",
      "size_bytes": 1235,
      "matched_include": "src/**"
    },
    {
      "source_path": "adapters/langchain-js/src/ingest.test.ts",
      "target_path": "adapters/langchain/src/ingest.test.ts",
      "sha256": "e6bc5e99e015ebd9c5fb881e5dc6a30f1d6d0164c0c87a61675758aa23dcc7f0",
      "size_bytes": 2220,
      "matched_include": "src/**"
    },
    {
      "source_path": "adapters/langchain-js/src/ingest.ts",
      "target_path": "adapters/langchain/src/ingest.ts",
      "sha256": "cd1924421e81388bc94f9bf08adcb2c59e78b71f683e43f0b16ccdb05fd5d181",
      "size_bytes": 1581,
      "matched_include": "src/**"
    },
    {
      "source_path": "adapters/langchain-js/src/search.test.ts",
      "target_path": "adapters/langchain/src/search.test.ts",
      "sha256": "fcb2f791d5f76f0fef5022f3d7b42926076f4a5434df2b35d58a913b63b2bbd0",
      "size_bytes": 2411,
      "matched_include": "src/**"
    },
    {
      "source_path": "adapters/langchain-js/src/search.ts",
      "target_path": "adapters/langchain/src/search.ts",
      "sha256": "2dca7ba2fff57ae020155183e58a3da417e998d6026a8aaaa056ec17cc451a4b",
      "size_bytes": 1862,
      "matched_include": "src/**"
    },
    {
      "source_path": "adapters/langchain-js/src/test-fixtures.ts",
      "target_path": "adapters/langchain/src/test-fixtures.ts",
      "sha256": "686c4db4f1d815c2624c17dd8acaff950bf327335e41161199b4818c040ff288",
      "size_bytes": 1363,
      "matched_include": "src/**"
    },
    {
      "source_path": "adapters/langchain-js/src/tools.test.ts",
      "target_path": "adapters/langchain/src/tools.test.ts",
      "sha256": "1df11e022d15d82ba9e54fa7be3aa4da460dfc04f8502100d5682bccf39a9e33",
      "size_bytes": 3130,
      "matched_include": "src/**"
    },
    {
      "source_path": "adapters/langchain-js/src/tools.ts",
      "target_path": "adapters/langchain/src/tools.ts",
      "sha256": "aaf23283a1d6b7e83fcc43d48c2ec6b8cb47ae163eafdc076540862876233616",
      "size_bytes": 3710,
      "matched_include": "src/**"
    },
    {
      "source_path": "adapters/langchain-js/tsconfig.json",
      "target_path": "adapters/langchain/tsconfig.json",
      "sha256": "5387dc745d87e9db26206985bc8353c061838a0dc45bddb5d4cca88a9716a03f",
      "size_bytes": 181,
      "matched_include": "tsconfig.json"
    }
  ],
  "summary": {
    "file_count": 11,
    "total_size_bytes": 22673
  },
  "verification": {
    "allowlist_checked": true,
    "inventory_source": "git tree at target_commit",
    "reviewer_signoff": "pending CODEOWNERS review",
    "note": "11 files matched against docs/migration/allowlists/adapter-langchain.json."
  }
}
