{
  "$schema": "../schemas/file-inventory.schema.json",
  "description": "File inventory for plugin-openclaw source snapshot.",
  "id": "plugin-openclaw",
  "source_repo": "atomicstrata/atomicmemory-integrations",
  "source_ref": "main",
  "source_commit": "287e9ba80f215a08588fd5da543bd15741c045dd",
  "source_subpath": "plugins/openclaw",
  "target_path": "plugins/openclaw",
  "target_commit": "25a2c6af4fde02be1f776e08ef44e7778b76216e",
  "allowlist": "docs/migration/allowlists/plugin-openclaw.json",
  "copied_on": "2026-05-18T01:56:30-07:00",
  "copy_tool": "scripts/ci/migration-inventories.mjs --write",
  "files": [
    {
      "source_path": "plugins/openclaw/README.md",
      "target_path": "plugins/openclaw/README.md",
      "sha256": "59dae699eb2edb853995aac29a468054c1d6cff9a449309a5fcadf80bf4270a1",
      "size_bytes": 3045,
      "matched_include": "README.md"
    },
    {
      "source_path": "plugins/openclaw/openclaw.plugin.json",
      "target_path": "plugins/openclaw/openclaw.plugin.json",
      "sha256": "0ff385ecfaced80cc20104e2eaafbbcae59318e9bd9bb3e568653da12d2af2b4",
      "size_bytes": 2112,
      "matched_include": "openclaw.plugin.json"
    },
    {
      "source_path": "plugins/openclaw/package.json",
      "target_path": "plugins/openclaw/package.json",
      "sha256": "18c7d88a8ffc2c6920e5999d90f5d76f7ed5fd94ad18d4850afa10baaac2775e",
      "size_bytes": 1230,
      "matched_include": "package.json"
    },
    {
      "source_path": "plugins/openclaw/skills/atomicmemory/instructions.md",
      "target_path": "plugins/openclaw/skills/atomicmemory/instructions.md",
      "sha256": "9c70f024f7e97205ae537feeeb7f1f2e03014b025689bbc43914ca79dfc90661",
      "size_bytes": 2326,
      "matched_include": "skills/**"
    },
    {
      "source_path": "plugins/openclaw/skills/atomicmemory/skill.yaml",
      "target_path": "plugins/openclaw/skills/atomicmemory/skill.yaml",
      "sha256": "acee10b77dd6eeb71e4d2b4a4de530e229c4767cdcc5b4622d057d0f5774b5cd",
      "size_bytes": 566,
      "matched_include": "skills/**"
    },
    {
      "source_path": "plugins/openclaw/src/index.test.ts",
      "target_path": "plugins/openclaw/src/index.test.ts",
      "sha256": "56dc1a850f8d3a2d3fc9c022942f0b5429eb6284c87a5c772758e9af4e4f15ae",
      "size_bytes": 3526,
      "matched_include": "src/**"
    },
    {
      "source_path": "plugins/openclaw/src/index.ts",
      "target_path": "plugins/openclaw/src/index.ts",
      "sha256": "1fabf0789c006841b28b06ab09be9fb12f4c9cdd65f95d9d3f7eef3499f4c962",
      "size_bytes": 8176,
      "matched_include": "src/**"
    },
    {
      "source_path": "plugins/openclaw/tsconfig.json",
      "target_path": "plugins/openclaw/tsconfig.json",
      "sha256": "1fc8024cd22a283aeb41995326613f180d434e4123e1e661cea1373acbdf8812",
      "size_bytes": 165,
      "matched_include": "tsconfig.json"
    }
  ],
  "summary": {
    "file_count": 8,
    "total_size_bytes": 21146
  },
  "verification": {
    "allowlist_checked": true,
    "inventory_source": "git tree at target_commit",
    "reviewer_signoff": "pending CODEOWNERS review",
    "note": "8 files matched against docs/migration/allowlists/plugin-openclaw.json."
  }
}
