{
  "$schema": "../schemas/file-inventory.schema.json",
  "description": "File inventory for plugin-hermes source snapshot.",
  "id": "plugin-hermes",
  "source_repo": "atomicstrata/atomicmemory-integrations",
  "source_ref": "main",
  "source_commit": "287e9ba80f215a08588fd5da543bd15741c045dd",
  "source_subpath": "plugins/hermes",
  "target_path": "plugins/hermes",
  "target_commit": "25a2c6af4fde02be1f776e08ef44e7778b76216e",
  "allowlist": "docs/migration/allowlists/plugin-hermes.json",
  "copied_on": "2026-05-18T01:56:30-07:00",
  "copy_tool": "scripts/ci/migration-inventories.mjs --write",
  "files": [
    {
      "source_path": "plugins/hermes/CHANGELOG.md",
      "target_path": "plugins/hermes/CHANGELOG.md",
      "sha256": "cacf9491d837d1120e2250b8212821a85465071b81e4a868b578fd94fe5f2928",
      "size_bytes": 1013,
      "matched_include": "CHANGELOG.md"
    },
    {
      "source_path": "plugins/hermes/README.md",
      "target_path": "plugins/hermes/README.md",
      "sha256": "1ebccfedb127454b4672c42695d50db4cb4bf86385cdb7cfa44517cd37cee737",
      "size_bytes": 6399,
      "matched_include": "README.md"
    },
    {
      "source_path": "plugins/hermes/__init__.py",
      "target_path": "plugins/hermes/__init__.py",
      "sha256": "c71306988dfb48b3d57a0d7055f1ecf4052bcb09e53827ac1a2660dffd2b988d",
      "size_bytes": 11769,
      "matched_include": "__init__.py"
    },
    {
      "source_path": "plugins/hermes/breaker.py",
      "target_path": "plugins/hermes/breaker.py",
      "sha256": "70ad8fc2584aa6fdfd7068bfa36ae38718d3ce61e603413671cb8c342f5716e2",
      "size_bytes": 1917,
      "matched_include": "breaker.py"
    },
    {
      "source_path": "plugins/hermes/client.py",
      "target_path": "plugins/hermes/client.py",
      "sha256": "24286434a4306cf05ae46faa9bf0fad85da1cc8af7fa15139ce4c0989e019f27",
      "size_bytes": 4168,
      "matched_include": "client.py"
    },
    {
      "source_path": "plugins/hermes/config.py",
      "target_path": "plugins/hermes/config.py",
      "sha256": "fe3b1c37f40664c319322540b7b21133bccae030eaa61f4171ba34e54f61255e",
      "size_bytes": 8373,
      "matched_include": "config.py"
    },
    {
      "source_path": "plugins/hermes/install.mjs",
      "target_path": "plugins/hermes/install.mjs",
      "sha256": "f39ef775de22a823bf2d7be59bcc09d49291e58ccabf55d6a3fae9832a58ebff",
      "size_bytes": 3308,
      "matched_include": "install.mjs"
    },
    {
      "source_path": "plugins/hermes/package.json",
      "target_path": "plugins/hermes/package.json",
      "sha256": "4d9526ad2480dd59a58c4f918f11bf2d2ad683960fd4ae34804e87b1ffa5c7af",
      "size_bytes": 990,
      "matched_include": "package.json"
    },
    {
      "source_path": "plugins/hermes/plugin.yaml",
      "target_path": "plugins/hermes/plugin.yaml",
      "sha256": "f7ea714eb07b2740b3516c871a22d0cf80187105feabfff72a383434478cfe67",
      "size_bytes": 306,
      "matched_include": "plugin.yaml"
    },
    {
      "source_path": "plugins/hermes/pyproject.toml",
      "target_path": "plugins/hermes/pyproject.toml",
      "sha256": "9311da14cf5bc3841a0ade39b7ce5138702759ad366655f2eab89766b0cf99b1",
      "size_bytes": 819,
      "matched_include": "pyproject.toml"
    },
    {
      "source_path": "plugins/hermes/python_sdk.py",
      "target_path": "plugins/hermes/python_sdk.py",
      "sha256": "a41cd600e214eaa4e13958f2c49ab9657aa6e9140a1665f1df5b56e4258e55c8",
      "size_bytes": 12506,
      "matched_include": "python_sdk.py"
    },
    {
      "source_path": "plugins/hermes/tests/__init__.py",
      "target_path": "plugins/hermes/tests/__init__.py",
      "sha256": "e3b0c44298fc1c149afbf4c8996fb92427ae41e4649b934ca495991b7852b855",
      "size_bytes": 0,
      "matched_include": "tests/**"
    },
    {
      "source_path": "plugins/hermes/tests/fakes.py",
      "target_path": "plugins/hermes/tests/fakes.py",
      "sha256": "e9753d56e82d73aa0ad71769e7eec6ff47c152fe681258973b7809091ae3a265",
      "size_bytes": 4303,
      "matched_include": "tests/**"
    },
    {
      "source_path": "plugins/hermes/tests/test_breaker.py",
      "target_path": "plugins/hermes/tests/test_breaker.py",
      "sha256": "a1d0d18a7ed0d94fc0554ab4924c2bedd98d5cbbda16a38b2e10ac6972e9445c",
      "size_bytes": 2022,
      "matched_include": "tests/**"
    },
    {
      "source_path": "plugins/hermes/tests/test_config.py",
      "target_path": "plugins/hermes/tests/test_config.py",
      "sha256": "281dae3a4ae0028772c04082ac3e3128a629b1e393a108947e2c5103658bc975",
      "size_bytes": 4620,
      "matched_include": "tests/**"
    },
    {
      "source_path": "plugins/hermes/tests/test_fakes.py",
      "target_path": "plugins/hermes/tests/test_fakes.py",
      "sha256": "f677c8c82852a2c9f0df30f5ba61adea94b9482afdd4a1e1dc9826c6ecf59859",
      "size_bytes": 4218,
      "matched_include": "tests/**"
    },
    {
      "source_path": "plugins/hermes/tests/test_install_path_imports.py",
      "target_path": "plugins/hermes/tests/test_install_path_imports.py",
      "sha256": "4ba6c8b9d9c1e03775a742aaa43e813ecb4e00b292f70002a8cf84779650077c",
      "size_bytes": 7018,
      "matched_include": "tests/**"
    },
    {
      "source_path": "plugins/hermes/tests/test_provider.py",
      "target_path": "plugins/hermes/tests/test_provider.py",
      "sha256": "fbe0a50e4b0b5f569f1affd3657cbe1d90290a794d486b71ffd260d2d7e3b915",
      "size_bytes": 11096,
      "matched_include": "tests/**"
    },
    {
      "source_path": "plugins/hermes/tests/test_python_sdk.py",
      "target_path": "plugins/hermes/tests/test_python_sdk.py",
      "sha256": "ad1fc4e1b6e6cfc9273a50c654407f0fe80f5a9508fe4c152223fee156ba4495",
      "size_bytes": 9838,
      "matched_include": "tests/**"
    },
    {
      "source_path": "plugins/hermes/tests/test_worker.py",
      "target_path": "plugins/hermes/tests/test_worker.py",
      "sha256": "05e824f5096b626af6b04301b29187dbc66a18c74e7b4bc2069b15383a03a6c2",
      "size_bytes": 2474,
      "matched_include": "tests/**"
    },
    {
      "source_path": "plugins/hermes/tools.py",
      "target_path": "plugins/hermes/tools.py",
      "sha256": "b9d8f5c72f9c4dedfa8c4990a9ab97d1b48977b7198c9873ed05642ecba58d26",
      "size_bytes": 6730,
      "matched_include": "tools.py"
    },
    {
      "source_path": "plugins/hermes/worker.py",
      "target_path": "plugins/hermes/worker.py",
      "sha256": "19d5eb6c889f68582d567816506a584e3ade4d6a247da73129504e613ed76969",
      "size_bytes": 3645,
      "matched_include": "worker.py"
    }
  ],
  "summary": {
    "file_count": 22,
    "total_size_bytes": 107532
  },
  "verification": {
    "allowlist_checked": true,
    "inventory_source": "git tree at target_commit",
    "reviewer_signoff": "pending CODEOWNERS review",
    "note": "22 files matched against docs/migration/allowlists/plugin-hermes.json."
  }
}
