{
  "$schema": "../schemas/file-inventory.schema.json",
  "description": "File inventory for adapter-mastra source snapshot.",
  "id": "adapter-mastra",
  "source_repo": "atomicstrata/atomicmemory-integrations",
  "source_ref": "feat/integration-maturity-framework-adapters",
  "source_commit": "c6e3b5082af08ff71128478c252894cc9aa6f002",
  "source_subpath": "adapters/mastra",
  "target_path": "adapters/mastra",
  "target_commit": "25a2c6af4fde02be1f776e08ef44e7778b76216e",
  "allowlist": "docs/migration/allowlists/adapter-mastra.json",
  "copied_on": "2026-05-18T01:56:30-07:00",
  "copy_tool": "scripts/ci/migration-inventories.mjs --write",
  "files": [
    {
      "source_path": "adapters/mastra/README.md",
      "target_path": "adapters/mastra/README.md",
      "sha256": "5012b35ca037a4b434e6e7f98738bc276c47f8629d8a2b5e812faf445647891e",
      "size_bytes": 2817,
      "matched_include": "README.md"
    },
    {
      "source_path": "adapters/mastra/package.json",
      "target_path": "adapters/mastra/package.json",
      "sha256": "983b43ce2fc77033d0ade83ed3a4ebd9482407fd6ade35f7434d79b357008cc3",
      "size_bytes": 1649,
      "matched_include": "package.json"
    },
    {
      "source_path": "adapters/mastra/src/index.ts",
      "target_path": "adapters/mastra/src/index.ts",
      "sha256": "f50546b879c25ae82bdb137952518180d39d402aac3f748c9ad426a72cf4c7f1",
      "size_bytes": 974,
      "matched_include": "src/**"
    },
    {
      "source_path": "adapters/mastra/src/ingest.test.ts",
      "target_path": "adapters/mastra/src/ingest.test.ts",
      "sha256": "9573a32cddd8a41a95980b9f58caa7548a0c948d8ce3391545fe84fb7b369fe1",
      "size_bytes": 2141,
      "matched_include": "src/**"
    },
    {
      "source_path": "adapters/mastra/src/ingest.ts",
      "target_path": "adapters/mastra/src/ingest.ts",
      "sha256": "db550ec42827a4c1fd923c5464d82d8634dc2aa13cbd74cfba10670c51132723",
      "size_bytes": 1149,
      "matched_include": "src/**"
    },
    {
      "source_path": "adapters/mastra/src/search.test.ts",
      "target_path": "adapters/mastra/src/search.test.ts",
      "sha256": "2f5cc514eaa3277b9d00555d8491983af89ecd1e2aa9cc2203c7cdc69675d2cb",
      "size_bytes": 1836,
      "matched_include": "src/**"
    },
    {
      "source_path": "adapters/mastra/src/search.ts",
      "target_path": "adapters/mastra/src/search.ts",
      "sha256": "82d2b6c956fa304e4490a523a0e6f07174953e5b58b77e384b83eea2dba566cf",
      "size_bytes": 1827,
      "matched_include": "src/**"
    },
    {
      "source_path": "adapters/mastra/src/test-fixtures.ts",
      "target_path": "adapters/mastra/src/test-fixtures.ts",
      "sha256": "6bc67551acc0569b5effd8a6b74f2ee0c3113e60f8518a64e7fd69064be71558",
      "size_bytes": 1257,
      "matched_include": "src/**"
    },
    {
      "source_path": "adapters/mastra/src/tools.test.ts",
      "target_path": "adapters/mastra/src/tools.test.ts",
      "sha256": "feb708879dc419e641094fcc4f540a93fa42bda973211ec14e762af83869dd4e",
      "size_bytes": 3252,
      "matched_include": "src/**"
    },
    {
      "source_path": "adapters/mastra/src/tools.ts",
      "target_path": "adapters/mastra/src/tools.ts",
      "sha256": "2e5de92a832a1a503b74739f1569e86b1703d7f5224a87543174a1116bf0d2da",
      "size_bytes": 3649,
      "matched_include": "src/**"
    },
    {
      "source_path": "adapters/mastra/tsconfig.json",
      "target_path": "adapters/mastra/tsconfig.json",
      "sha256": "5387dc745d87e9db26206985bc8353c061838a0dc45bddb5d4cca88a9716a03f",
      "size_bytes": 181,
      "matched_include": "tsconfig.json"
    }
  ],
  "summary": {
    "file_count": 11,
    "total_size_bytes": 20732
  },
  "verification": {
    "allowlist_checked": true,
    "inventory_source": "git tree at target_commit",
    "reviewer_signoff": "pending CODEOWNERS review",
    "note": "11 files matched against docs/migration/allowlists/adapter-mastra.json."
  }
}
