{
  "$schema": "../schemas/file-inventory.schema.json",
  "description": "File inventory for adapter-vercel-ai source snapshot.",
  "id": "adapter-vercel-ai",
  "source_repo": "atomicstrata/atomicmemory-integrations",
  "source_ref": "main",
  "source_commit": "287e9ba80f215a08588fd5da543bd15741c045dd",
  "source_subpath": "adapters/vercel-ai-sdk",
  "target_path": "adapters/vercel-ai",
  "target_commit": "25a2c6af4fde02be1f776e08ef44e7778b76216e",
  "allowlist": "docs/migration/allowlists/adapter-vercel-ai.json",
  "copied_on": "2026-05-18T01:56:30-07:00",
  "copy_tool": "scripts/ci/migration-inventories.mjs --write",
  "files": [
    {
      "source_path": "adapters/vercel-ai-sdk/README.md",
      "target_path": "adapters/vercel-ai/README.md",
      "sha256": "1fd40f0550f35c182f349c88db85cde6e049b47ac94912e2d5a5a2f5222ea7e0",
      "size_bytes": 5443,
      "matched_include": "README.md"
    },
    {
      "source_path": "adapters/vercel-ai-sdk/package.json",
      "target_path": "adapters/vercel-ai/package.json",
      "sha256": "9eeceb79056479ff50f7eb0e1cc7f459d21eee45ae4c695a44306ec9fc9d6305",
      "size_bytes": 1528,
      "matched_include": "package.json"
    },
    {
      "source_path": "adapters/vercel-ai-sdk/src/augment.test.ts",
      "target_path": "adapters/vercel-ai/src/augment.test.ts",
      "sha256": "70408283ae85e8e3316551ce687c7d66847d515327bbb39ef55296514579174f",
      "size_bytes": 2879,
      "matched_include": "src/**"
    },
    {
      "source_path": "adapters/vercel-ai-sdk/src/augment.ts",
      "target_path": "adapters/vercel-ai/src/augment.ts",
      "sha256": "7abb0eeb0e6cf2290698427c88ff00f62de1953bfced2feb4f8bac462c6e162b",
      "size_bytes": 1624,
      "matched_include": "src/**"
    },
    {
      "source_path": "adapters/vercel-ai-sdk/src/from-model-message.test.ts",
      "target_path": "adapters/vercel-ai/src/from-model-message.test.ts",
      "sha256": "4e8e5ca5232a39ea1ff571174f14ff1690f9624ce4e07d65f0d32607c5ba97dc",
      "size_bytes": 2460,
      "matched_include": "src/**"
    },
    {
      "source_path": "adapters/vercel-ai-sdk/src/from-model-message.ts",
      "target_path": "adapters/vercel-ai/src/from-model-message.ts",
      "sha256": "53250ed7038a5800404b9445eb343ccf8577acbb69027619ab834e6426c9f169",
      "size_bytes": 2801,
      "matched_include": "src/**"
    },
    {
      "source_path": "adapters/vercel-ai-sdk/src/index.ts",
      "target_path": "adapters/vercel-ai/src/index.ts",
      "sha256": "71ef08912f5949838f0f9eb005ecc186d579b45a41c4b4c2a2be299ab194cbc0",
      "size_bytes": 1314,
      "matched_include": "src/**"
    },
    {
      "source_path": "adapters/vercel-ai-sdk/src/ingest.test.ts",
      "target_path": "adapters/vercel-ai/src/ingest.test.ts",
      "sha256": "dc53ad176cff4dd83ba8058d5b617b0c1630e197cc1fd254571ee6f4894a6a09",
      "size_bytes": 2440,
      "matched_include": "src/**"
    },
    {
      "source_path": "adapters/vercel-ai-sdk/src/ingest.ts",
      "target_path": "adapters/vercel-ai/src/ingest.ts",
      "sha256": "df638a7df8627c28b7712b880ca7492e59f9f865ecb674ca672cf89779cea446",
      "size_bytes": 1933,
      "matched_include": "src/**"
    },
    {
      "source_path": "adapters/vercel-ai-sdk/src/retrieve.test.ts",
      "target_path": "adapters/vercel-ai/src/retrieve.test.ts",
      "sha256": "d7b1ddcf96d94378f22e329493f27fbe87c6b554ea8b50a1f4fc0fb15e137fa3",
      "size_bytes": 2814,
      "matched_include": "src/**"
    },
    {
      "source_path": "adapters/vercel-ai-sdk/src/retrieve.ts",
      "target_path": "adapters/vercel-ai/src/retrieve.ts",
      "sha256": "ffa2d3e953ce255fac0c22e0f54c890639ced10bc20a5d1838047297ce0a0191",
      "size_bytes": 2954,
      "matched_include": "src/**"
    },
    {
      "source_path": "adapters/vercel-ai-sdk/src/test-fixtures.ts",
      "target_path": "adapters/vercel-ai/src/test-fixtures.ts",
      "sha256": "1e7900a8f30cbad3d9f2ee46f63b6d378a8faee16c9f65975f0126d977a5233b",
      "size_bytes": 1450,
      "matched_include": "src/**"
    },
    {
      "source_path": "adapters/vercel-ai-sdk/src/with-memory.test.ts",
      "target_path": "adapters/vercel-ai/src/with-memory.test.ts",
      "sha256": "019f954657da547b8a7d72da6ac8baa7142c19b2e2f48521596cf768a39f05e7",
      "size_bytes": 2383,
      "matched_include": "src/**"
    },
    {
      "source_path": "adapters/vercel-ai-sdk/src/with-memory.ts",
      "target_path": "adapters/vercel-ai/src/with-memory.ts",
      "sha256": "23869b3cdc2ccc51551eaec02182edb7f7309c6d2b16944ba609d02812818463",
      "size_bytes": 2338,
      "matched_include": "src/**"
    },
    {
      "source_path": "adapters/vercel-ai-sdk/tsconfig.json",
      "target_path": "adapters/vercel-ai/tsconfig.json",
      "sha256": "5387dc745d87e9db26206985bc8353c061838a0dc45bddb5d4cca88a9716a03f",
      "size_bytes": 181,
      "matched_include": "tsconfig.json"
    }
  ],
  "summary": {
    "file_count": 15,
    "total_size_bytes": 34542
  },
  "verification": {
    "allowlist_checked": true,
    "inventory_source": "git tree at target_commit",
    "reviewer_signoff": "pending CODEOWNERS review",
    "note": "15 files matched against docs/migration/allowlists/adapter-vercel-ai.json."
  }
}
