{
  "$schema": "../schemas/file-inventory.schema.json",
  "description": "File inventory for plugin-codex source snapshot.",
  "id": "plugin-codex",
  "source_repo": "atomicstrata/atomicmemory-integrations",
  "source_ref": "main",
  "source_commit": "287e9ba80f215a08588fd5da543bd15741c045dd",
  "source_subpath": "plugins/codex",
  "target_path": "plugins/codex",
  "target_commit": "25a2c6af4fde02be1f776e08ef44e7778b76216e",
  "allowlist": "docs/migration/allowlists/plugin-codex.json",
  "copied_on": "2026-05-18T01:56:30-07:00",
  "copy_tool": "scripts/ci/migration-inventories.mjs --write",
  "files": [
    {
      "source_path": "plugins/codex/.codex-mcp.json",
      "target_path": "plugins/codex/.codex-mcp.json",
      "sha256": "4fc1030b37fff56a47d53e4e528dd4a6f9c51d20117b15b230440994160d97e9",
      "size_bytes": 437,
      "matched_include": ".codex-mcp.json"
    },
    {
      "source_path": "plugins/codex/.codex-plugin/plugin.json",
      "target_path": "plugins/codex/.codex-plugin/plugin.json",
      "sha256": "df0ed07263cff4586ae800efea91d0bd5249a75ea48ff3550afbf5c9e6a9e52f",
      "size_bytes": 1483,
      "matched_include": ".codex-plugin/**"
    },
    {
      "source_path": "plugins/codex/README.md",
      "target_path": "plugins/codex/README.md",
      "sha256": "9fef288a152c1c4c891a1c9818c971f113ba6aa49f106b01fcc64b590d783b0b",
      "size_bytes": 7497,
      "matched_include": "README.md"
    },
    {
      "source_path": "plugins/codex/logo.svg",
      "target_path": "plugins/codex/logo.svg",
      "sha256": "14c0d2339d8b845b1876e35dfd449302f6f3a88a67f26ffc53cb943059b8081d",
      "size_bytes": 776,
      "matched_include": "logo.svg"
    },
    {
      "source_path": "plugins/codex/marketplace.example.json",
      "target_path": "plugins/codex/marketplace.example.json",
      "sha256": "6d91d67fd41dad0586a0c31763db6fa2143f26f62299a63ef1fbe1ca27d35095",
      "size_bytes": 587,
      "matched_include": "marketplace.example.json"
    },
    {
      "source_path": "plugins/codex/package.json",
      "target_path": "plugins/codex/package.json",
      "sha256": "09fdf97aa3882ffaa9853e0afad948f64c15b52723fff1a083f97edd91c67cf5",
      "size_bytes": 518,
      "matched_include": "package.json"
    },
    {
      "source_path": "plugins/codex/skills/atomicmemory/SKILL.md",
      "target_path": "plugins/codex/skills/atomicmemory/SKILL.md",
      "sha256": "62e324e5df6d5ea16238c1944a81cf3f20cccab3d5f6dcaa583f53ede2dec57f",
      "size_bytes": 3901,
      "matched_include": "skills/**"
    }
  ],
  "summary": {
    "file_count": 7,
    "total_size_bytes": 15199
  },
  "verification": {
    "allowlist_checked": true,
    "inventory_source": "git tree at target_commit",
    "reviewer_signoff": "pending CODEOWNERS review",
    "note": "7 files matched against docs/migration/allowlists/plugin-codex.json."
  }
}
