{
  "$schema": "../schemas/file-inventory.schema.json",
  "description": "File inventory for plugin-cursor source snapshot.",
  "id": "plugin-cursor",
  "source_repo": "atomicstrata/atomicmemory-integrations",
  "source_ref": "main",
  "source_commit": "287e9ba80f215a08588fd5da543bd15741c045dd",
  "source_subpath": "plugins/cursor",
  "target_path": "plugins/cursor",
  "target_commit": "25a2c6af4fde02be1f776e08ef44e7778b76216e",
  "allowlist": "docs/migration/allowlists/plugin-cursor.json",
  "copied_on": "2026-05-18T01:56:30-07:00",
  "copy_tool": "scripts/ci/migration-inventories.mjs --write",
  "files": [
    {
      "source_path": "plugins/cursor/.cursor/mcp.json",
      "target_path": "plugins/cursor/.cursor/mcp.json",
      "sha256": "f559612c226593a6f5284e7ce106129ffdec09c72efc089eb6e179d0df82bed2",
      "size_bytes": 656,
      "matched_include": ".cursor/**"
    },
    {
      "source_path": "plugins/cursor/.cursor/rules/atomicmemory.mdc",
      "target_path": "plugins/cursor/.cursor/rules/atomicmemory.mdc",
      "sha256": "ffbd068873ca60d48d9735f2c520a245998edecfd8563c4eb3506ba28e4aed22",
      "size_bytes": 2426,
      "matched_include": ".cursor/**"
    },
    {
      "source_path": "plugins/cursor/README.md",
      "target_path": "plugins/cursor/README.md",
      "sha256": "219a8b1a7fa9fdf4d948f1d394fe41cfb4f1868d4fd4e64f3c22c8fc112e2ef1",
      "size_bytes": 3165,
      "matched_include": "README.md"
    },
    {
      "source_path": "plugins/cursor/package.json",
      "target_path": "plugins/cursor/package.json",
      "sha256": "37c2cb8465338af84560c1ddc18fc8be1eb60ea6cc3e59e340b5489f603fb7a2",
      "size_bytes": 431,
      "matched_include": "package.json"
    }
  ],
  "summary": {
    "file_count": 4,
    "total_size_bytes": 6678
  },
  "verification": {
    "allowlist_checked": true,
    "inventory_source": "git tree at target_commit",
    "reviewer_signoff": "pending CODEOWNERS review",
    "note": "4 files matched against docs/migration/allowlists/plugin-cursor.json."
  }
}
